term,category,is_abbreviation,full_form,breakdown,definition,example_usage,synonyms,aliases,tags,,,,,,,,,
Digoxin Level,Lab Test,FALSE,Digoxin Level,,Measures blood level of digoxin heart medicine.,Digoxin level is 1.2 ng/mL in therapeutic range.,{},{},"{lab,diagnostic,chemistry,therapeutic-drug}",,,,,,,,,
Vancomycin Level,Lab Test,FALSE,Vancomycin Level,,Measures blood level of vancomycin antibiotic.,Vancomycin trough is 18 mcg/mL.,{},{},"{lab,diagnostic,chemistry,therapeutic-drug}",,,,,,,,,
Phenytoin Level,Lab Test,FALSE,Phenytoin Level,,Measures blood level of anti-seizure medicine phenytoin.,Phenytoin level too low at 6 mcg/mL.,{},{Dilantin level},"{lab,diagnostic,chemistry,therapeutic-drug}",,,,,,,,,
Theophylline Level,Lab Test,FALSE,Theophylline Level,,Measures blood level of theophylline asthma medicine.,Theophylline level is 12 mcg/mL within range.,{},{},"{lab,diagnostic,chemistry,therapeutic-drug}",,,,,,,,,
HIV Test,Lab Test,FALSE,HIV Test,,A screening test for human immunodeficiency virus.,Fourth generation HIV test is best.,{},"{HIV antibody,HIV antigen}","{lab,diagnostic,immunology,infectious}",,,,,,,,,
Hepatitis Panel,Lab Panel,FALSE,Hepatitis Panel,,Tests for hepatitis A B and C viruses.,Hepatitis panel ordered for yellow skin patient.,{},{},"{lab,diagnostic,immunology,infectious}",,,,,,,,,
HBsAg,Lab Test,TRUE,Hepatitis B Surface Antigen,,A marker of active hepatitis B infection.,Positive HBsAg means current HBV infection.,{},{},"{lab,diagnostic,immunology,infectious}",,,,,,,,,
Anti-HBs,Lab Test,FALSE,Hepatitis B Surface Antibody,,Shows immunity to hepatitis B from vaccine or past infection.,Positive anti-HBs shows HBV immunity.,{},{},"{lab,diagnostic,immunology,infectious}",,,,,,,,,
HCV Antibody,Lab Test,FALSE,Hepatitis C Antibody,,Screening test for hepatitis C virus.,Positive HCV antibody needs RNA test to confirm.,{},{},"{lab,diagnostic,immunology,infectious}",,,,,,,,,
RPR,Lab Test,TRUE,Rapid Plasma Reagin,,A screening test for syphilis.,Positive RPR confirmed with FTA-ABS.,{},{},"{lab,diagnostic,immunology,infectious}term",category,is_abbreviation,full_form,breakdown,definition,example_usage,synonyms,aliases,tags
RTE,Insurance,TRUE,Real-Time Eligibility,,A computer check that shows if a patient's insurance is active and what it covers.,Front desk staff run RTE before scheduling.,{},{},"{insurance,billing}",,,,,,,,,
Co-pay,Insurance,FALSE,Co-payment,,A set amount of money a patient pays when they visit the doctor.,Patient paid a $20 co-pay at check-in.,{},{},"{insurance,billing}",,,,,,,,,
Deductible,Insurance,FALSE,Insurance Deductible,,The amount a patient must pay before their insurance starts paying for care.,The patient has a $1500 deductible to meet.,{},{},"{insurance,billing}",,,,,,,,,
Coinsurance,Insurance,FALSE,Coinsurance,,The percentage of the bill a patient pays after meeting their deductible.,Patient is responsible for 20% coinsurance.,{},{},"{insurance,billing}",,,,,,,,,
EOB,Insurance,TRUE,Explanation of Benefits,,A paper or online statement showing what the insurance paid and what the patient owes.,Review the EOB to understand the claim payment.,{},{},"{insurance,billing}",,,,,,,,,
OOP,Insurance,TRUE,Out-of-Pocket,,The most money a patient pays in one year before insurance covers everything.,Patient has reached their $5000 OOP maximum.,{},{out-of-pocket maximum},"{insurance,billing}",,,,,,,,,
Prior Auth,Insurance,FALSE,Prior Authorization,,Permission from insurance needed before getting certain tests or treatments.,MRI requires prior auth before scheduling.,{},"{PA,pre-authorization}","{insurance,billing,approval}",,,,,,,,,
PPO,Insurance,TRUE,Preferred Provider Organization,,A type of insurance plan where you can see any doctor but pay less for in-network doctors.,Patient has a PPO plan and can self-refer.,{},{},"{insurance,plan-type}",,,,,,,,,
HMO,Insurance,TRUE,Health Maintenance Organization,,A type of insurance that requires you to use specific doctors and get referrals to see specialists.,HMO patients need a referral to see specialists.,{},{},"{insurance,plan-type}",,,,,,,,,
POS,Insurance,TRUE,Point of Service,,An insurance plan that mixes HMO and PPO rules.,POS plan requires PCP coordination but allows out-of-network.,{},{},"{insurance,plan-type}",,,,,,,,,
Medicare,Insurance,FALSE,Medicare,,Government health insurance mainly for people 65 and older.,Patient is eligible for Medicare Part B.,{},{},"{insurance,government}",,,,,,,,,
Medicaid,Insurance,FALSE,Medicaid,,Government health insurance for people with low income.,Patient has Medicaid coverage for the visit.,{},{},"{insurance,government}",,,,,,,,,
Premium,Insurance,FALSE,Insurance Premium,,The monthly payment to keep an insurance plan active.,Monthly premium is $450 for family coverage.,{},{},"{insurance,billing}",,,,,,,,,
Covered Services,Insurance,FALSE,Covered Services,,Medical care and tests that an insurance plan will pay for.,Annual physical is a covered service.,{},{},"{insurance,benefits}",,,,,,,,,
Exclusions,Insurance,FALSE,Insurance Exclusions,,Services or treatments that insurance will not pay for.,Cosmetic procedures are plan exclusions.,{},{},"{insurance,benefits}",,,,,,,,,
In-Network,Insurance,FALSE,In-Network Provider,,Doctors and hospitals that have an agreement with your insurance company.,Using in-network providers saves money.,{},{},"{insurance,network}",,,,,,,,,
Out-of-Network,Insurance,FALSE,Out-of-Network Provider,,Doctors and hospitals that do not have an agreement with your insurance company.,Out-of-network services cost more for patients.,{},{},"{insurance,network}",,,,,,,,,
Allowable Amount,Insurance,FALSE,Allowable Amount,,The maximum amount insurance will pay for a service.,The allowable amount for the visit was $150.,{},{},"{insurance,billing}",,,,,,,,,
Claim,Insurance,FALSE,Insurance Claim,,A request sent to insurance asking them to pay for services.,Submit the claim within 30 days of service.,{},{},"{insurance,billing}",,,,,,,,,
Denied Claim,Insurance,FALSE,Denied Claim,,An insurance request that was rejected and will not be paid.,The claim was denied due to missing information.,{},{},"{insurance,billing}",,,,,,,,,
GERD,Insurance,FALSE,Gastroesophageal Reflux Disease,,A common condition where stomach acid flows back into the throat causing heartburn.,Patient diagnosed with GERD needs PPI medication.,{},"{acid reflux,heartburn}","{insurance,diagnosis,gi}",,,,,,,,,
TES,Insurance,TRUE,Third-Party Eligibility System,,A system that checks if a patient's insurance is active and what services are covered.,Run TES check before scheduling the appointment.,{},{},"{insurance,billing,system}",,,,,,,,,
HPI,Documentation,TRUE,History of Present Illness,,A description of when the patient's symptoms started and how they have changed.,The HPI documents when pain started and how bad it is.,{},{},"{documentation,clinical}",,,,,,,,,
ROS,Documentation,TRUE,Review of Systems,,A checklist asking about symptoms in different parts of the body.,Complete ROS includes all 14 body systems.,{},{},"{documentation,clinical}",,,,,,,,,
PE,Documentation,TRUE,Physical Examination,,When a doctor checks the patient's body by looking listening and touching.,PE showed normal heart and lung sounds.,{},{physical exam},"{documentation,clinical}",,,,,,,,,
Dx,Documentation,TRUE,Diagnosis,,The name of the disease or condition the patient has.,Primary Dx is type 2 diabetes.,{},{},"{documentation,clinical}",,,,,,,,,
Tx,Documentation,TRUE,Treatment,,The medical care given to help the patient get better.,Tx includes lifestyle changes and metformin.,{},{},"{documentation,clinical}",,,,,,,,,
Encounter,Documentation,FALSE,Patient Encounter,,A single visit between a patient and their doctor.,Document the encounter in the EHR.,{},"{visit,appointment}","{documentation,workflow}",,,,,,,,,
Episode,Documentation,FALSE,Episode of Care,,A group of visits for the same health problem.,The pneumonia episode included 3 office visits.,{},{},"{documentation,workflow}",,,,,,,,,
SOAP,Documentation,TRUE,Subjective Objective Assessment Plan,,A way to write medical notes using four sections.,Use SOAP format for progress notes.,{},{},"{documentation,format}",,,,,,,,,
CC,Documentation,TRUE,Chief Complaint,,The main reason the patient came to see the doctor.,CC is chest pain for 2 hours.,{},{},"{documentation,clinical}",,,,,,,,,
PMH,Documentation,TRUE,Past Medical History,,A list of all health problems the patient has had before.,PMH includes high blood pressure and GERD.,{},{},"{documentation,clinical}",,,,,,,,,
PSH,Documentation,TRUE,Past Surgical History,,A list of all surgeries the patient has had.,PSH includes appendectomy in 2010.,{},{},"{documentation,clinical}",,,,,,,,,
FH,Documentation,TRUE,Family History,,Information about diseases that run in the patient's family.,FH significant for heart disease and diabetes.,{},{},"{documentation,clinical}",,,,,,,,,
SH,Documentation,TRUE,Social History,,Information about the patient's lifestyle like smoking and drinking.,SH reveals 20 pack-year smoking history.,{},{},"{documentation,clinical}",,,,,,,,,
Allergies,Documentation,FALSE,Allergy List,,A list of things that cause bad reactions in the patient.,Allergies include penicillin and shellfish.,{},{},"{documentation,clinical,safety}",,,,,,,,,
Medications,Documentation,FALSE,Medication List,,A current list of all medicines the patient is taking.,Medication list updated at every visit.,{},"{med list,current meds}","{documentation,clinical,safety}",,,,,,,,,
Vital Signs,Documentation,FALSE,Vital Signs,,Basic body measurements like temperature and blood pressure.,Vital signs stable and normal.,{},{vitals},"{documentation,clinical}",,,,,,,,,
Progress Note,Documentation,FALSE,Progress Note,,A note written during follow-up visits showing how the patient is doing.,Progress note shows improvement in symptoms.,{},{},"{documentation,clinical}",,,,,,,,,
Discharge Summary,Documentation,FALSE,Discharge Summary,,A report written when a patient leaves the hospital.,Discharge summary sent to PCP.,{},{},"{documentation,clinical}",,,,,,,,,
H&P,Documentation,TRUE,History and Physical,,A complete first exam including patient history and physical check.,Complete H&P documented on admission.,{},{},"{documentation,clinical}",,,,,,,,,
Impression,Documentation,FALSE,Clinical Impression,,The doctor's conclusion about what is wrong with the patient.,Impression is acute bronchitis.,{},{},"{documentation,clinical}",,,,,,,,,
Plan of Care,Documentation,FALSE,Plan of Care,,The treatment plan and next steps for the patient.,Plan of care includes antibiotics and recheck in 3 days.,{},{treatment plan},"{documentation,clinical}",,,,,,,,,
Orders,Documentation,FALSE,Medical Orders,,Instructions written by the doctor for medicines or tests.,Orders include CBC and basic metabolic panel.,{},{},"{documentation,clinical}",,,,,,,,,
CBC,Lab Panel,TRUE,Complete Blood Count,,A blood test that measures different parts of blood including red cells white cells and platelets.,Order CBC to check for anemia.,{},{complete blood count},"{lab,diagnostic,hematology}",,,,,,,,,
WBC,Lab Test,TRUE,White Blood Cell Count,,Counts the number of white blood cells that fight infection.,High WBC suggests infection.,{},{leukocyte count},"{lab,diagnostic,hematology}",,,,,,,,,
RBC,Lab Test,TRUE,Red Blood Cell Count,,Counts the number of red blood cells that carry oxygen.,Low RBC means anemia.,{},{erythrocyte count},"{lab,diagnostic,hematology}",,,,,,,,,
Hemoglobin,Lab Test,FALSE,Hemoglobin,,A protein in red blood cells that carries oxygen through the body.,Hemoglobin is 10.2 showing anemia.,{},"{Hgb,Hb}","{lab,diagnostic,hematology}",,,,,,,,,
Hematocrit,Lab Test,FALSE,Hematocrit,,Shows what percent of blood is made of red blood cells.,Hematocrit of 32% is below normal.,{},{Hct},"{lab,diagnostic,hematology}",,,,,,,,,
Platelet Count,Lab Test,FALSE,Platelet Count,,Counts the platelets that help blood clot.,Low platelets increase bleeding risk.,{},{PLT},"{lab,diagnostic,hematology}",,,,,,,,,
MCV,Lab Test,TRUE,Mean Corpuscular Volume,,Measures the average size of red blood cells.,High MCV may mean vitamin deficiency.,{},{},"{lab,diagnostic,hematology}",,,,,,,,,
MCH,Lab Test,TRUE,Mean Corpuscular Hemoglobin,,Measures how much hemoglobin is in each red blood cell.,MCH helps find the type of anemia.,{},{},"{lab,diagnostic,hematology}",,,,,,,,,
MCHC,Lab Test,TRUE,Mean Corpuscular Hemoglobin Concentration,,Measures how concentrated hemoglobin is in red blood cells.,High MCHC seen in some blood disorders.,{},{},"{lab,diagnostic,hematology}",,,,,,,,,
RDW,Lab Test,TRUE,Red Cell Distribution Width,,Measures if red blood cells are different sizes.,High RDW shows mixed types of anemia.,{},{},"{lab,diagnostic,hematology}",,,,,,,,,
Differential,Lab Test,FALSE,Differential Count,,Breaks down the different types of white blood cells.,Differential shows high neutrophils.,{},"{diff,WBC diff}","{lab,diagnostic,hematology}",,,,,,,,,
Neutrophils,Lab Test,FALSE,Neutrophils,,White blood cells that fight bacterial infections.,High neutrophils mean bacterial infection.,{},"{polys,PMNs}","{lab,diagnostic,hematology}",,,,,,,,,
Lymphocytes,Lab Test,FALSE,Lymphocytes,,White blood cells that fight viruses and help immunity.,High lymphocytes suggest viral infection.,{},{lymphs},"{lab,diagnostic,hematology}",,,,,,,,,
Monocytes,Lab Test,FALSE,Monocytes,,White blood cells that eat germs and dead cells.,High monocytes in long-term inflammation.,{},{monos},"{lab,diagnostic,hematology}",,,,,,,,,
Eosinophils,Lab Test,FALSE,Eosinophils,,White blood cells involved in allergies and parasite infections.,High eosinophils suggest allergies or parasites.,{},{eos},"{lab,diagnostic,hematology}",,,,,,,,,
Basophils,Lab Test,FALSE,Basophils,,White blood cells involved in allergic reactions.,High basophils are rare.,{},{basos},"{lab,diagnostic,hematology}",,,,,,,,,
BMP,Lab Panel,TRUE,Basic Metabolic Panel,,A blood test checking electrolytes kidney function and blood sugar.,Order BMP to check kidney function.,{},{},"{lab,diagnostic,chemistry}",,,,,,,,,
Sodium,Lab Test,FALSE,Sodium,,A salt in blood that helps balance fluids and nerves.,Sodium level is 138 mEq/L.,{},{Na},"{lab,diagnostic,chemistry}",,,,,,,,,
Potassium,Lab Test,FALSE,Potassium,,A mineral critical for heart and muscle function.,Potassium is 4.2 mEq/L.,{},{K},"{lab,diagnostic,chemistry}",,,,,,,,,
Chloride,Lab Test,FALSE,Chloride,,A salt that helps maintain fluid balance in the body.,Chloride level is normal at 102 mEq/L.,{},{Cl},"{lab,diagnostic,chemistry}",,,,,,,,,
CO2,Lab Test,FALSE,Carbon Dioxide,,Measures bicarbonate which shows acid-base balance.,CO2 of 24 means normal balance.,{},"{bicarbonate,HCO3}","{lab,diagnostic,chemistry}",,,,,,,,,
BUN,Lab Test,TRUE,Blood Urea Nitrogen,,Measures waste filtered by kidneys to check kidney function.,High BUN suggests kidney problems.,{},{},"{lab,diagnostic,chemistry,renal}",,,,,,,,,
Creatinine,Lab Test,FALSE,Creatinine,,A waste product used to check how well kidneys work.,Creatinine of 1.8 means decreased kidney function.,{},{Cr},"{lab,diagnostic,chemistry,renal}",,,,,,,,,
Glucose,Lab Test,FALSE,Blood Glucose,,Measures the amount of sugar in the blood.,Fasting glucose is 110 mg/dL.,{},{blood sugar},"{lab,diagnostic,chemistry,diabetes}",,,,,,,,,
CMP,Lab Panel,TRUE,Comprehensive Metabolic Panel,,A bigger blood test that includes BMP plus liver and protein tests.,Order CMP for complete health check.,{},{},"{lab,diagnostic,chemistry}",,,,,,,,,
Total Protein,Lab Test,FALSE,Total Protein,,Measures all proteins in blood to check nutrition and liver health.,Total protein helps check liver function.,{},{},"{lab,diagnostic,chemistry}",,,,,,,,,
Albumin,Lab Test,FALSE,Albumin,,A protein made by the liver that keeps fluid balanced.,Low albumin means malnutrition or liver disease.,{},{},"{lab,diagnostic,chemistry}",,,,,,,,,
AST,Lab Test,TRUE,Aspartate Aminotransferase,,A liver enzyme that goes up when the liver is damaged.,AST of 85 suggests liver inflammation.,{},{SGOT},"{lab,diagnostic,chemistry,hepatic}",,,,,,,,,
ALT,Lab Test,TRUE,Alanine Aminotransferase,,A liver enzyme that is very specific for liver damage.,High ALT means liver injury.,{},{SGPT},"{lab,diagnostic,chemistry,hepatic}",,,,,,,,,
ALP,Lab Test,TRUE,Alkaline Phosphatase,,An enzyme in liver and bones that goes up with certain diseases.,High ALP suggests blocked bile ducts.,{},{},"{lab,diagnostic,chemistry,hepatic}",,,,,,,,,
Total Bilirubin,Lab Test,FALSE,Total Bilirubin,,A yellow substance from broken down red blood cells.,High bilirubin causes jaundice.,{},{},"{lab,diagnostic,chemistry,hepatic}",,,,,,,,,
Direct Bilirubin,Lab Test,FALSE,Direct Bilirubin,,Bilirubin that has been processed by the liver.,High direct bilirubin in blocked bile ducts.,{},{},"{lab,diagnostic,chemistry,hepatic}",,,,,,,,,
Indirect Bilirubin,Lab Test,FALSE,Indirect Bilirubin,,Bilirubin that has not been processed by the liver yet.,High indirect bilirubin in blood cell breakdown.,{},{},"{lab,diagnostic,chemistry,hepatic}",,,,,,,,,
Calcium,Lab Test,FALSE,Calcium,,A mineral important for bones nerves and muscles.,Calcium level is 9.5 mg/dL.,{},{Ca},"{lab,diagnostic,chemistry}",,,,,,,,,
Lipid Panel,Lab Panel,FALSE,Lipid Panel,,A blood test checking cholesterol and fats to assess heart risk.,Fasting lipid panel shows high LDL.,{},{cholesterol panel},"{lab,diagnostic,chemistry,cardiology}",,,,,,,,,
Total Cholesterol,Lab Test,FALSE,Total Cholesterol,,Measures all cholesterol in blood including good and bad types.,Total cholesterol is 220 mg/dL.,{},{},"{lab,diagnostic,chemistry,cardiology}",,,,,,,,,
HDL,Lab Test,TRUE,High-Density Lipoprotein,,Good cholesterol that helps remove bad cholesterol from blood.,HDL of 55 mg/dL is protective.,{},{good cholesterol},"{lab,diagnostic,chemistry,cardiology}",,,,,,,,,
LDL,Lab Test,TRUE,Low-Density Lipoprotein,,Bad cholesterol that can clog arteries and cause heart disease.,LDL of 150 mg/dL is above goal.,{},{bad cholesterol},"{lab,diagnostic,chemistry,cardiology}",,,,,,,,,
Triglycerides,Lab Test,FALSE,Triglycerides,,A type of fat in blood that increases heart disease risk when high.,Triglycerides are 180 mg/dL.,{},{TG},"{lab,diagnostic,chemistry,cardiology}",,,,,,,,,
VLDL,Lab Test,TRUE,Very Low-Density Lipoprotein,,A type of cholesterol that carries triglycerides in blood.,VLDL is calculated from triglycerides.,{},{},"{lab,diagnostic,chemistry,cardiology}",,,,,,,,,
HbA1c,Lab Test,TRUE,Hemoglobin A1c,,Shows average blood sugar over the past 2-3 months for diabetes.,HbA1c of 7.2% means diabetes not well controlled.,{},"{glycated hemoglobin,A1c}","{lab,diagnostic,chemistry,diabetes}",,,,,,,,,
Thyroid Panel,Lab Panel,FALSE,Thyroid Panel,,Tests that check how well the thyroid gland is working.,Thyroid panel ordered to check for low thyroid.,{},{},"{lab,diagnostic,chemistry,endocrine}",,,,,,,,,
TSH,Lab Test,TRUE,Thyroid-Stimulating Hormone,,A hormone that controls the thyroid gland.,High TSH means low thyroid function.,{},{thyrotropin},"{lab,diagnostic,chemistry,endocrine}",,,,,,,,,
T3,Lab Test,TRUE,Triiodothyronine,,Active thyroid hormone that controls metabolism.,Free T3 helps check thyroid function.,{},{},"{lab,diagnostic,chemistry,endocrine}",,,,,,,,,
T4,Lab Test,TRUE,Thyroxine,,Main hormone made by the thyroid gland.,Free T4 measures available hormone.,{},{},"{lab,diagnostic,chemistry,endocrine}",,,,,,,,,
Free T3,Lab Test,FALSE,Free Triiodothyronine,,Active thyroid hormone not bound to proteins.,Free T3 is low in low thyroid.,{},{},"{lab,diagnostic,chemistry,endocrine}",,,,,,,,,